ord,id,nom_estab,raz_social,codigo_act,nombre_act,per_ocu,tipo_vial,nom_vial,tipo_v_e_1,nom_v_e_1,tipo_v_e_2,nom_v_e_2,tipo_v_e_3,nom_v_e_3,numero_ext,letra_ext,edificio,edificio_e,numero_int,letra_int,tipo_asent,nomb_asent,tipoCenCom,nom_CenCom,num_local,cod_postal,cve_ent,entidad,cve_mun,municipio,cve_loc,localidad,ageb,manzana,telefono,correoelec,www,tipoUniEco,latitud,longitud,fecha_alta,subrama
7,6400177,AGROINDUSTRIA BROCA Y ABREU SA DE CV,AGROINDUSTRIA BROCA Y ABREU SA DE CV,311930,"Elaboración de concentrados, polvos, jarabes y esencias de sabor para bebidas",0 a 5 personas,AVENIDA,16 DE SEPTIEMBRE,AVENIDA,16 DE SEPTIEMBRE,AVENIDA,PASEO DE LA SIERRA,AVENIDA,PASEO USUMACINTA,615,,,NA,0,,COLONIA,PRIMERO DE MAYO,,,,86190,27,TABASCO,4,Centro,1,Villahermosa,1492,19,,,,Fijo,17.97220622,-92.93048851,2010-07,31193
10,3981340,ALIMENTOS INTEGRO NATURALES,ALIMENTOS INTEGRONATURALES SA,311214,Elaboración de harina de otros productos agrícolas,0 a 5 personas,CALLE,RÍO OMETEPEC,CALLE,RÍO OMETEPEC,CALLE,RÍO TACOTALPA,ANDADOR,RÍO CONCORDIA,101,,,NA,0,,COLONIA,ESPEJO 2,,,,86109,27,TABASCO,4,Centro,1,Villahermosa,742,7,,,WWW.COLPAC.COM.MX,Fijo,17.99883818,-92.95878389,2010-07,31121
32,8838297,BODEGA LA ANITA CONDIMENTOS Y SALSAS SA DE CV,LA ANITA CONDIMENTOS Y SALSAS SA DE CV,311940,Elaboración de condimentos y aderezos,11 a 30 personas,AVENIDA,LAGUNA DE LAS ILUSIONES,CALLE,FEDERAL,CIRCUITO,LAGUNA EL CORCHO,CALLE,RETORNO 1,0,SN,,NA,0,,FRACCIONAMIENTO,LAGUNAS PRIMERA ETAPA,,,,86019,27,TABASCO,4,Centro,1,Villahermosa,2236,8,,SEDIS.VILLAHERMOSA@LAANITA.COM,,Fijo,18.03676165,-92.90100367,2019-11,31194
44,9337075,CAFETERIA SIN NOMBRE,,311923,Elaboración de café instantáneo,0 a 5 personas,CALLE,BENITO JUAREZ GARCIA,CALLE,NINGUNO,CALLE,SEBASTIAN LERDO,CALLE,CLEMENTE FIGUEROA,NA,SN,,5,NA,,COLONIA,CENTRO,MERCADO PUBLICO,ALVARO OBREGON,17,NA,27,TABASCO,15,Tacotalpa,1,Tacotalpa,163,22,,CHUAFLORES.74@GMAIL.COM,,Fijo,17.59116709,-92.8259196,2021-05,31192
55,7670318,CHICHARON Y CARNITAS LA PROMESA ESMERALDA,,311910,Elaboración de botanas,0 a 5 personas,CALLE,CARLOS GREENE,CERRADA,CARLOS GREENE,CALLE,FRANCISCO I. MADERO,CALLE,REVOLUCIÓN,NA,SN,,NA,NA,,COLONIA,ATASTA DE SERRA,,,,86100,27,TABASCO,4,Centro,1,Villahermosa,827,42,9932774700,,,Fijo,17.98117701,-92.95255327,2019-11,31191
88,3980589,DULCES REGIONALES LO QUE TIENE TABASCO,,311340,"Elaboración de dulces, chicles y productos de confitería que no sean de chocolate",0 a 5 personas,AVENIDA,JOSE MARIA PINO SUAREZ,CALLE,AMADO NERVO,CALLE,HERMANOS BASTAR ZOZAYA,AVENIDA,CONSTITUCIÓN,702,,MERCADO PUBLICO,1,NA,,COLONIA,ARBOLEDAS,MERCADO PUBLICO,MERCADO PUBLICO JOSE MARIA PINO SUAREZ.,1052,86100,27,TABASCO,4,Centro,1,Villahermosa,723,9,9141292046,,,Fijo,17.99652098,-92.91506085,2010-07,31134
294,9060838,LA CASA DE LA REPOSTERIA,,311812,Panificación tradicional,0 a 5 personas,CALLE,MANUEL PEREZ MERINO,CALLE,SAN LORENZO,CALLE,LIC. CARLOS ALBERTO MADRAZO BECERRA,CALLE,LIC. CARLOS ALBERTO MADRAZO BECERRA,NA,SN,,NA,NA,,COLONIA,GRACIELA PINTADO DE MADRAZO,,,,86870,27,TABASCO,15,Tacotalpa,1,Tacotalpa,197,3,9321000595,,,Fijo,17.60013556,-92.82841355,2019-11,31181
297,8375776,LA CASA DEL VOLOVAN,,311812,Panificación tradicional,0 a 5 personas,CALLE,EUSEBIO CASTILLO,CALLE,HERMANOS BASTAR ZOZAYA,CALLE,JOSE BULNES,CALLE,JUAN ÁLVAREZ,1304,,,NA,NA,,COLONIA,ARBOLEDAS,,,,86000,27,TABASCO,4,Centro,1,Villahermosa,009A,9,,,,Fijo,17.9982109,-92.91970917,2019-11,31181
312,9342166,LA PASADITA,LA PASADITA ,311423,Conservación de guisos y otros alimentos preparados por procesos distintos a la congelación,0 a 5 personas,PRIVADA,NINGUNO,AVENIDA,FRANCISCO TRUJILLO GURRIA,CALLE,EMILIANO ZAPATA,AVENIDA,FRANCISCO TRUJILLO GURRÍA,102,INT1,,NA,NA,,COLONIA,JOSE MARIA PINO SUARES,,,,NA,27,TABASCO,4,Centro,1,Villahermosa,13,23,9933724294,,,Fijo,18.02405955,-92.92164669,2021-05,31142
316,7152495,LAS DELICIAS DE EUNICE ROSALDO,,311812,Panificación tradicional,0 a 5 personas,CALLE,ABRAHAM LINCOLN,CALLE,24,CALLE,SINDICATO DE AGRICULTURA,OTRO (ESPECIFIQUE),LAGO,314,,,NA,NA,,COLONIA,LOPEZ MATEO,,,,86040,27,TABASCO,4,Centro,1,Villahermosa,85,8,9932542682,,,Fijo,17.99754097,-92.9305172,2019-11,31181
345,7709831,MATANZA DE RES,,311611,"Matanza de ganado, aves y otros animales comestibles",0 a 5 personas,CALLE,20 DE NOVIEMBRE,PRIVADA,NINGUNO,OTRO (ESPECIFIQUE),NINGUNO,OTRO (ESPECIFIQUE),NINGUNO,NA,SN,,NA,NA,,COLONIA,LAMAJAHUA,,,,86170,27,TABASCO,4,Centro,1,Villahermosa,2344,23,,,,Fijo,17.95445958,-92.93233769,2019-11,31161
389,4005334,MOMI GALLETAS,,311820,Elaboración de galletas y pastas para sopa,0 a 5 personas,AVENIDA,LAGUNA DE LAS ILUSIONES,CALLE,LAGUNA POMPOSU,CIRCUITO,LAGUNA LA MACHONA,CALLE,RETORNO 1,8,A,,NA,202,,FRACCIONAMIENTO,LAGUNAS PRIMERA ETAPA,,,,86019,27,TABASCO,4,Centro,1,Villahermosa,2236,8,9933852302,,,Fijo,18.03626619,-92.89798567,2014-12,31182
477,7329463,PALETERIA Y NEVERIA,,311520,Elaboración de helados y paletas,0 a 5 personas,AVENIDA,MARTIRES DE CANANEA,AVENIDA,MARTIRES DE RIO BLANCO,ANDADOR,HERRERO,ANDADOR,ANDADOR DEL CARPINTERO,NA,SN,,NA,NA,,COLONIA,COLONIA INDECO,,,,86017,27,TABASCO,4,Centro,1,Villahermosa,1524,12,,,,Fijo,18.0197257,-92.90066626,2019-11,31152
816,7991995,PANADERIA RAYMUNDO,,311812,Panificación tradicional,6 a 10 personas,AVENIDA,MALECON INGENIERO LEANDRO ROVIROSA WADE,CALLE,FRANCISCO JOSE HERNANDEZ MANDUJANO,CALLE,BENITO JUAREZ,CALLE,ALFONSO VICENS SALDIVAR,445,,,NA,0,,COLONIA,FRACC LOS CEDROS,,,,86090,27,TABASCO,4,Centro,1,Villahermosa,1257,26,9933119862,,,Fijo,17.99027201,-92.91372269,2019-11,31181
1070,7709123,PASTELERIA GLADYS,,311812,Panificación tradicional,0 a 5 personas,CALLE,GREGORIO MENDEZ MAGAÑA,PRIVADA,GREGORIO MENDEZ MAGAÑA,CALLE,PRIMERA CERRADA GREGORIO MENDEZ,CALLE,QUINTA CERRADA DE MÉNDEZ PASCUAL BELLIZZIA CASTAÑEDA,509,SN,,NA,NA,,COLONIA,PUNTA BRAVA,,,,86150,27,TABASCO,4,Centro,1,Villahermosa,899,18,9931923243,,,Fijo,17.96984865,-92.96422301,2019-11,31181
1120,4007563,PASTELERIA SABOR Y HOGAR,,311812,Panificación tradicional,0 a 5 personas,AVENIDA,CORONEL GREGORIO MENDEZ MAGAÑA,AVENIDA,27 DE FEBRERO,AVENIDA,CORONEL GREGORIO MENDEZ MAGAÑA,CALLE,REFORMA,2611,,,NA,NA,,COLONIA,ATASTA,,,,86100,27,TABASCO,4,Centro,1,Villahermosa,831,16,,,,Fijo,17.983969,-92.94619991,2014-12,31181
1151,7152197,PASTELES LAS DELICIAS,,311812,Panificación tradicional,0 a 5 personas,CALLE,JUAN SOSA MAZARIEGO,CALLE,CHOCO TABASQUEÑO,ANDADOR,2,CALLE,ANTONIO DE DIOS GUARDIA,103,,,NA,0,,COLONIA,GAVIOTAS NORTE SECTOR EXPLANADA,,,,86090,27,TABASCO,4,Centro,1,Villahermosa,1280,19,,,,Fijo,17.98218129,-92.91789848,2019-11,31181
1265,8345397,PRODUCTOS TAPIJULAPA,CEREALES PROCESADOS SA DE CV,311350,Elaboración de chocolate y productos de chocolate,11 a 30 personas,AVENIDA,HIERRO,CERRADA,HIERRO,CERRADA,NIQUEL,CALLE,HELIO,NA,SN,,NA,NA,,CIUDAD INDUSTRIAL,INSURGENTES,,,,86010,27,TABASCO,4,Centro,1,Villahermosa,151A,7,,,,Fijo,18.03290348,-92.90527404,2019-11,31135
1368,7632982,TAMALES DOÑA FINA,,311993,Elaboración de alimentos frescos para consumo inmediato,0 a 5 personas,CALLE,INDEPENDENCIA,CALLE,CHILPANCINGO,CALLE,MARIANO ABASOLO,CALLE,MIGUEL HIDALGO Y COSTILLA,16,LOTE,,NA,NA,,COLONIA,MIGUEL HIDALGO,,,,86126,27,TABASCO,4,Centro,1,Villahermosa,1365,5,9983395364,,,Fijo,17.97357315,-92.98268232,2019-11,31199
1404,6879052,TORTILLERIA 2 DE ABRIL,CORPORACION SANCHEZ SA DE CV,311830,Elaboración de tortillas de maíz y molienda de nixtamal,11 a 30 personas,CALLE,2 DE ABRIL,CALLE,CUITLÁHUAC,AVENIDA,FRANCISCO JAVIER MINA,CALLE,CERRADA DE CUITLÁHUAC,291,,,NA,NA,,COLONIA,CENTRO,,,,86000,27,TABASCO,4,Centro,1,Villahermosa,1473,6,,AREAFISCALGS@SANCHEZGRUPO.COM,,Fijo,17.99365815,-92.92477203,2019-04,31183
1438,3974423,TORTILLERIA ARI,,311830,Elaboración de tortillas de maíz y molienda de nixtamal,6 a 10 personas,CALLE,CONGRESO DE CHILPANCINGO,CALLE,JESUS CARRANZA,CALLE,BENITO JUAREZ,CALLE,MIGUEL HIDALGO Y COSTILLA,NA,SN,,NA,NA,,COLONIA,LAGUNAS,,,,86019,27,TABASCO,4,Centro,1,Villahermosa,1666,7,,,,Fijo,18.03268514,-92.89770476,2010-07,31183
1459,4005035,TORTILLERIA BUFALOS,,311830,Elaboración de tortillas de maíz y molienda de nixtamal,0 a 5 personas,AVENIDA,ALTOS HORNOS,ANDADOR,ANDADOR DEL GRABADOR,AVENIDA,MARTIRES DE RIO BLANCO,ANDADOR,ANDADOR DEL ZAPATERO,NA,SN,,NA,NA,,COLONIA,COLONIA INDECO,,,,86017,27,TABASCO,4,Centro,1,Villahermosa,634,11,,,,Fijo,18.02159759,-92.89758068,2014-12,31183
1737,4017459,TORTILLERIA LA LUPITA,,311830,Elaboración de tortillas de maíz y molienda de nixtamal,0 a 5 personas,CALLE,27 DE FEBRERO,CALLE,GRACIELA PINTADO DE MADRAZO,CALLE,20 DE NOVIEMBRE,CALLE,DOMINGO BORREGO,NA,SN,,NA,NA,,FRACCIONAMIENTO,ORO VERDE,,,,86870,27,TABASCO,15,Tacotalpa,1,Tacotalpa,159,11,9321126450,,,Fijo,17.59634407,-92.82471134,2010-07,31183
1982,3974537,TORTILLERIA SILVIA ROSA,,311830,Elaboración de tortillas de maíz y molienda de nixtamal,0 a 5 personas,CALLE,GARDENIAS,CALLE,JACINTO TICOMAN,CALLE,TLAPACOYA,CALLE,GARDENIAS,218,,,NA,NA,,COLONIA,INFONAVIT,,,,86018,27,TABASCO,4,Centro,1,Villahermosa,1187,23,,,,Fijo,18.02797285,-92.90275277,2010-07,31183
2020,3974719,TORTILLERIA VILLEGAS,,311830,Elaboración de tortillas de maíz y molienda de nixtamal,0 a 5 personas,AVENIDA,ALTOS HORNOS,CALLE,GARDENIAS,CALLE,CHICANEL,CALLE,PETÉN,NA,SN,,NA,NA,,COLONIA,INFONAVIT,,,,86010,27,TABASCO,4,Centro,1,Villahermosa,1191,37,,,,Fijo,18.02491817,-92.90396123,2010-07,31183
2172,4020441,VENTA DE PAN SIN NOMBRE,,311812,Panificación tradicional,0 a 5 personas,CALLE,EJIDO,CALLE,DOCTOR CARDENAS,PROLONGACION,EJIDO,CALLE,LIBERTAD,210,,,NA,NA,,COLONIA,TAMULTE DE LAS BARRANCAS,,,,86150,27,TABASCO,4,Centro,1,Villahermosa,244,11,,,,Fijo,17.97259521,-92.95327346,2010-07,31181
2391,8316122,VENTA DE QUESOS ANGEL,,311513,Elaboración de derivados y fermentos lácteos,0 a 5 personas,CALLE,CARRETERA VILLAHERMOSA-LA ISLA,PRIVADA,NINGUNO,PRIVADA,NINGUNO,OTRO (ESPECIFIQUE),NINGUNO,NA,SN,,NA,NA,,RANCHERIA,MIGUEL HIDALGO 1RA SECC,,,,86250,27,TABASCO,4,Centro,1,Villahermosa,2626,24,,,,Fijo,17.96231571,-93.01432036,2019-11,31151
2450,6400735,2390 CD INDUSTRIAL,BIMBO SA DE CV,431191,Comercio al por mayor de pan y pasteles,101 a 250 personas,CALLE,OXÍGENO,CALLE,CAMELLON DE DEFENSA,CALLE,NITROGENO,CALLE,NINGUNO,0,SN,,NA,NA,,CIUDAD INDUSTRIAL,2A ETAPA,,,,86010,27,TABASCO,4,Centro,1,Villahermosa,2240,3,,,WWW.BIMBO.COM.MX,Fijo,18.0447095,-92.90384659,2010-07,43119
2467,9278963,ABARROTERA SUPER SANCHEZ,ABARROTERA SUPER SANCHEZ ,431110,Comercio al por mayor de abarrotes,11 a 30 personas,CALLE,EJIDO ACACHAPAN Y COLMENA,CALLE,EJIDO IXTACOMITAN,CALLE,EJIDO CHIQUIGUAO,CALLE,EJIDO PUEBLO NUEVO,NA,SN,,NA,NA,,COLONIA,LA MANGA II,,,,86068,27,TABASCO,4,Centro,1,Villahermosa,719,13,,,,Fijo,17.99898482,-92.90942265,2020-11,43111
2588,6276143,DISTRIBUIDORA DE LACTEOS ALGIL VILLAHERMOSA,DISTRIBUIDORA DE LACTEOS ALGIL SA DE CV,431160,Comercio al por mayor de leche y otros productos lácteos,51 a 100 personas,CALLE,FEDERAL,AVENIDA,LAGUNA LA PÓLVORA,AVENIDA,LAGUNA DEL ROSARIO,CALLE,LAGUNA CANTEMOC,0,SN,,NA,0,,FRACCIONAMIENTO,LAGUNAS,,,,86019,27,TABASCO,4,Centro,1,Villahermosa,2236,8,,,,Fijo,18.03679254,-92.90125786,2014-12,43116
2602,6399284,ESENCIAS DEL SURESTE,ESENCIAS DEL SURESTE SA,431180,Comercio al por mayor de dulces y materias primas para repostería,0 a 5 personas,CALLE,JUAN ÁLVAREZ,CALLE,HERMANOS BASTAR ZOZAYA,CALLE,JOSÉ BULNES,CALLE,EUSEBIO CASTILLO,613,,,NA,0,,COLONIA,CENTRO,,,,NA,27,TABASCO,4,Centro,1,Villahermosa,009A,9,,ESUTB@HOTMAIL.COM,,Fijo,17.9986348,-92.91966931,2010-07,43118
2605,6399824,EXPENDIO DE POLLOS SANTA TERESA,OPERADORA TABASQUEÑA ROMPER SA DE CV,431122,Comercio al por mayor de carne de aves,31 a 50 personas,CARRETERA,ESTATAL LIBRE VILLAHERMOSALA ISLA MARGEN DERECHO,VIADUCTO,MAGARA,VIADUCTO,CARRIZAL,VIADUCTO,NINGUNO,190,,,NA,NA,,COLONIA,MIGUEL HIDALGO,,,,86126,27,TABASCO,4,Centro,1,Villahermosa,1098,16,,GRUPO.ROMEROXML@GMAIL.COM,,Fijo,17.97990699,-92.97630098,2010-07,43112
2659,3981864,PAQUIMÉ,,431130,Comercio al por mayor de frutas y verduras frescas,0 a 5 personas,CALLE,NINGUNO,CALLE,NINGUNO,CALLE,NINGUNO,CALLE,NINGUNO,NA,SN,,NA,NA,,COLONIA,CARRIZAL,,,15,86108,27,TABASCO,4,Centro,1,Villahermosa,1562,10,,,,Fijo,17.99140135,-92.96591429,2010-07,43113
2673,6237783,QUALITA ALIMENTOS OPERACIONES TABASCO,QUALTIA ALIMENTOS OPERACIONES S DE RL DE CV,431170,Comercio al por mayor de embutidos,31 a 50 personas,CERRADA,DE ANTIMONIO  BODEGA,CERRADA,ANTIMONIO,PROLONGACION,DE ANTIMONIO,AVENIDA,ALUMINIO,5,,,NA,NA,,COLONIA,CIUDAD INDUSTRIAL,,,,86010,27,TABASCO,4,Centro,1,Villahermosa,151A,12,,,WWW.QUALTIA.COM.MX,Fijo,18.02440862,-92.91071983,2010-07,43117
2694,6276131,SURTIENDA,COMERCIALIZADORA DE ALIMENTOS VARIOS SA DE CV,431140,Comercio al por mayor de huevo,6 a 10 personas,AVENIDA,GENERAL AUGUSTO CÉSAR SANDINO,CALLE,ANDRÉS GARCÍA,CALLE,MANUEL TÉLLEZ,AUTOPISTA,QUINTÍN ARAUZ CARRILLO,320,,,NA,NA,,COLONIA,PRIMERO DE MAYO,,,,86190,27,TABASCO,4,Centro,1,Villahermosa,1492,15,,CALVARIO_VHSA@HOTAMIL.COM,,Fijo,17.97846417,-92.93524355,2010-07,43114
2715,4012874,VENTA DE CHILES SECOS,,431150,"Comercio al por mayor de semillas y granos alimenticios, especias y chiles secos",0 a 5 personas,CALLE,DAMIAN PIZA BELTRAN,CALLE,HUMBERTO TAPIA CORDOVA,BOULEVARD,LICENCIADO FRANCISCO TRUJILLO GURRIA,CALLE,DAMIÁN PIZA BELTRÁN,1,,MERCADO PUBLICO,1,NA,,COLONIA,TEAPA CENTRO,MERCADO PUBLICO,DIANA CORDOVA DE BALBOA,1,86800,27,TABASCO,16,Teapa,1,Teapa,194,6,,,,Fijo,17.55371336,-92.94848978,2014-12,43115
2818,7152514,ABARROTE SIN NOMBRE,,461110,"Comercio al por menor en tiendas de abarrotes, ultramarinos y misceláneas",0 a 5 personas,CALLE,RIO GRIJALVA,CALLE,CAMELLON DE DEFENSA,CALLE,RIO GRIJALVA,OTRO (ESPECIFIQUE),NINGUNO,NA,SN,,NA,NA,,COLONIA,GAVIOTAS SUR SECTOR ARMENIA,,,,86090,27,TABASCO,4,Centro,1,Villahermosa,1929,23,,,,Fijo,17.96919698,-92.90958676,2019-11,46111
3739,7708983,ABARROTES EL PELON,,461110,"Comercio al por menor en tiendas de abarrotes, ultramarinos y misceláneas",0 a 5 personas,AVENIDA,CORONEL GREGORIO MENDEZ MAGAÑA,CALLE,ABRAHAM BANDALA,CALLE,CERRADA ITURBIDE,CALLE,AGUSTÍN DE ITURBIDE,3506,,,NA,NA,,COLONIA,TAMULTE DE LAS BARRANCAS,,,,86126,27,TABASCO,4,Centro,1,Villahermosa,1100,23,,,,Fijo,17.96963357,-92.95865309,2019-11,46111
3911,7632514,ABARROTES ESTRELLA,,461110,"Comercio al por menor en tiendas de abarrotes, ultramarinos y misceláneas",0 a 5 personas,CALLE,REVOLUCION,PRIVADA,NINGUNO,PRIVADA,NINGUNO,PRIVADA,CARLOS GREENE,387,,,NA,NA,,COLONIA,FRACC INFONAVIT,,,,86100,27,TABASCO,4,Centro,1,Villahermosa,1083,1,,,,Fijo,17.98304723,-92.95852493,2019-11,46111
4314,3976415,ABARROTES LA BENDICION DE DIOS,,461110,"Comercio al por menor en tiendas de abarrotes, ultramarinos y misceláneas",0 a 5 personas,CALLE,LAGUNA DE LAS ILUSIONES,CALLE,LAGUNA LA MAJAHUA,CALLE,LAGUNA LA ADUANA,CALLE,CAMELLÓN,23,,,NA,NA,,COLONIA,LA MANGA III,,,,86068,27,TABASCO,4,Centro,1,Villahermosa,1242,20,,,,Fijo,17.99633316,-92.90525617,2010-07,46111
4343,7731317,ABARROTES LA CEIBA,,461110,"Comercio al por menor en tiendas de abarrotes, ultramarinos y misceláneas",0 a 5 personas,ANDADOR,LA VIA,CALLE,CARRETERA A LAS GRUTAS,CALLE,ANDRES QUINTANA ROO,OTRO (ESPECIFIQUE),CULTIVO,0,SN,,NA,0,,COLONIA,GRUTAS,,,,86801,27,TABASCO,16,Teapa,1,Teapa,230,16,,,,Fijo,17.56530443,-92.93806851,2019-11,46111
4382,8784296,ABARROTES LA DIVINA PROVIDENCIA,,461110,"Comercio al por menor en tiendas de abarrotes, ultramarinos y misceláneas",0 a 5 personas,CERRADA,J. CLARO MENDEZ,CALLE,PRINCIPAL,OTRO (ESPECIFIQUE),NINGUNO,CALLE,JESÚS REYES HEROLES,108,,,NA,NA,,FRACCIONAMIENTO,LOMAS DEL DORADO,,,,86179,27,TABASCO,4,Centro,1,Villahermosa,2151,1,,,,Fijo,17.95826609,-92.95027318,2019-11,46111
5361,4001469,ABARROTES MONTERREY,ABARROTES MONTERREY SA DE CV,462112,Comercio al por menor en minisupers,0 a 5 personas,BOULEVARD,ADOLFO RUÍZ CORTINES,BOULEVARD,FRANCISCO I. MADERO,CALLE,VENUSTIANO CARRANZA,CALLE,HERMANOS BASTAR ZOZAYA,114,,,NA,NA,,COLONIA,CENTRO,,,,86000,27,TABASCO,4,Centro,1,Villahermosa,723,1,,,WWW.ABARROTESMONTERREY.COM.MX,Fijo,17.99812161,-92.91547555,2014-12,46211
5465,6400376,ABARROTES MONTERREY,ABARROTES MONTERREY SA DE CV,462112,Comercio al por menor en minisupers,0 a 5 personas,CARRETERA,CARRETERA VILLAHERMOSA-LA ISLA,,16,,JUAN DE LA BARRERA,,JUAN DE LA BARRERA,0,SN,,NA,NA,,COLONIA,MIGUEL HIDALGO,,,,86126,27,TABASCO,4,Centro,1,Villahermosa,219A,10,,FROYLANAPANCO@ABMTY.COM.MX,WWW.ABMTY.COM,Fijo,17.97421075,-92.99125452,2010-07,46211
5475,6400677,ABARROTES MONTERREY,ABARROTES MONTERREY SA DE CV,462112,Comercio al por menor en minisupers,11 a 30 personas,CALLE,Río Mezcalapa,CALLE,Calle de las Bellas Artes,CALLE,Ninguno,CALLE,0,114,,,NA,0,,COLONIA,FOVISSSTE CASABLANCA,,,,86060,27,TABASCO,4,Centro,1,Villahermosa,1543,37,,FROYLANAPANCO@ABMTY.COM.MX,WWW.ABARROTESMONTERREY.COM.MX,Fijo,18.00230576,-92.91222822,2010-07,46211
5976,4001503,ABARROTES SIN NOMBRE,,461110,"Comercio al por menor en tiendas de abarrotes, ultramarinos y misceláneas",0 a 5 personas,CALLE,RIO USUMACINTA,CALLE,RIO MEZCALAPA,CALLE,RIO SAMARIA,CALLE,RÍO LA SIERRA,45,,,NA,0,,COLONIA,CASA BLANCA,,,,86060,27,TABASCO,4,Centro,1,Villahermosa,1543,25,,,,Fijo,18.0003717,-92.91479375,2014-12,46111
6738,4000157,BODEGA DE PESCADOS Y MARISCOS CAMILO,,461123,Comercio al por menor de pescados y mariscos,0 a 5 personas,CALLE,4,CALLE,9,CALLE,10,CALLE,3,210,,,NA,NA,,COLONIA,LA MANGA I,,,,86069,27,TABASCO,4,Centro,1,Villahermosa,1257,8,9934121480,,,Fijo,17.99532663,-92.91016733,2014-12,46112
7519,3977244,CARNICERIA LA BENDICION DE DIOS,,461121,Comercio al por menor de carnes rojas,0 a 5 personas,CALLE,FRANCISCO SARABIA,CALLE,AQUILES SERDAN,CALLE,VENUSTIANO CARRANZA,CALLE,AYUNTAMIENTO,202,,,NA,NA,,COLONIA,GIL Y SAENZ,,,,86080,27,TABASCO,4,Centro,1,Villahermosa,140,11,,,,Fijo,17.98502371,-92.93463636,2010-07,46112
7681,3980261,CARNICERIA LEON,,461121,Comercio al por menor de carnes rojas,0 a 5 personas,AVENIDA,JOSE MARIA PINO SUAREZ,CALLE,AMADO NERVO,CALLE,HERMANOS BASTAR ZOZAYA,AVENIDA,CONSTITUCIÓN,702,,MERCADO PUBLICO,1,NA,,COLONIA,ARBOLEDAS,MERCADO PUBLICO,MERCADO PUBLICO: JOSE MARIA PINO SUAREZ.,59,86100,27,TABASCO,4,Centro,1,Villahermosa,723,9,,,,Fijo,17.99652098,-92.91506085,2010-07,46112
7954,6867999,CEDIS REFRIGERADOS,CORPORACION SANCHEZ SA DE CV,462112,Comercio al por menor en minisupers,51 a 100 personas,AVENIDA,COBRE,AVENIDA,ACERO,AVENIDA,HIERRO,AVENIDA,ALUMINIO,0,SN,,NA,NA,,CIUDAD INDUSTRIAL,CIUDAD INDUSTRIAL,,,,86010,27,TABASCO,4,Centro,1,Villahermosa,151A,2,,AREAFISCALGS@SANCHEZGRUPO.COM,,Fijo,18.03033218,-92.90666943,2019-04,46211
7992,8345210,CHILES SECOS ESPECIAS Y PLANTAS MEDICINALES SIN NOMBRE,,461140,"Comercio al por menor de semillas y granos alimenticios, especias y chiles secos",0 a 5 personas,AVENIDA,JOSE MARIA PINO SUAREZ,CALLE,AMADO NERVO,CALLE,HERMANOS BASTAR ZOZAYA,AVENIDA,CONSTITUCIÓN,702,,MERCADO PUBLICO,1,NA,,COLONIA,ARBOLEDAS,MERCADO PUBLICO,MERCADO PUBLICO: JOSE MARIA PINO SUAREZ.,77 78,86100,27,TABASCO,4,Centro,1,Villahermosa,723,9,9933823555,,,Fijo,17.99652098,-92.91506085,2019-11,46114
8384,6399822,DULCERIA LA ESTRELLA,DULCERIA LA ESTRELLA SA DE CV,461160,Comercio al por menor de dulces y materias primas para repostería,6 a 10 personas,CALLE,GENERAL IGNACIO COMONFORT,PROLONGACION,HIDALGO,CALLE,REVOLUCIÓN,ANDADOR,ARROYO CHININ,246,,,NA,NA,,COLONIA,TAMULTE DE LAS BARRANCAS,,,,86150,27,TABASCO,4,Centro,1,Villahermosa,087A,12,,VAZELVA_81@HOTMAIL.COM,,Fijo,17.97188464,-92.95965809,2010-07,46116
8504,7770090,EL SURTIDOR VENTA DE GRANOS Y SEMILLAS,,461140,"Comercio al por menor de semillas y granos alimenticios, especias y chiles secos",0 a 5 personas,CALLE,MIGUEL HIDALGO,CALLE,AGUSTIN DE ITURBIDE,AVENIDA,CORONEL GREGORIO MENDEZ MAGAÑA,CALLE,VICENTE GUERRERO,NA,SN,,NA,NA,,COLONIA,TAMULTE DE LAS BARRANCAS,,,,86150,27,TABASCO,4,Centro,1,Villahermosa,244,18,,,,Fijo,17.97133485,-92.95794882,2019-11,46114
8591,7329652,EXPENDIO DE CARNE CARDOZA PEREZ,,461121,Comercio al por menor de carnes rojas,0 a 5 personas,CALLE,LAGUNA DEL ESPEJO,CALLE,LAGUNA COVADONGA,CALLE,LAGUNA CHILTEPEC,CALLE,LAGUNA DE LAS ILUSIONES,319,,,NA,NA,,COLONIA,LA MANGA III,,,,86068,27,TABASCO,4,Centro,1,Villahermosa,1242,10,,,,Fijo,17.99504173,-92.90745018,2019-11,46112
8599,3975209,EXPENDIO DE CARNE DE CERDO,,461121,Comercio al por menor de carnes rojas,0 a 5 personas,CALLE,BUENA VISTA,CALLE,NIÑOS HEROES,CALLE,JOSE MARIA MORELOS Y PAVON,AVENIDA,27 DE FEBRERO,NA,SN,TABASCO AVANZA,1,88,,COLONIA,JOSE COLOMO,MERCADO PUBLICO,TABASCO AVANZA,88,86100,27,TABASCO,4,Centro,1,Villahermosa,916,25,9932308385,,,Fijo,17.98535075,-92.94738424,2010-07,46112
8654,4004444,EXPENDIO DE PAN,,461190,Comercio al por menor de otros alimentos,0 a 5 personas,AVENIDA,27 DE FEBRERO,PRIVADA,NINGUNO,CALLE,AQUILES SERDAN,CALLE,REVOLUCIÓN,1602,,,NA,0,,COLONIA,GIL Y SAENZ,,,,86000,27,TABASCO,4,Centro,1,Villahermosa,812,15,,,,Fijo,17.98320579,-92.93377466,2010-07,46119
8670,7144460,EXPENDIO DE PAN GABY,,461190,Comercio al por menor de otros alimentos,0 a 5 personas,AVENIDA,PASEO DE LA SIERRA,AVENIDA,ESPERANZA IRIS,AVENIDA,PASEO USUMACINTA,AVENIDA,ESPERANZA IRIS,1,,MERCADO PUBLICO,5,NA,,COLONIA,GUAYABAL,MERCADO PUBLICO,MERCADO GREGORIO MENDEZ MAGAÑA,186,86090,27,TABASCO,4,Centro,1,Villahermosa,846,13,,,,Fijo,17.9795758,-92.9295484,2019-11,46119
8814,6399414,EXPENDIO TAMULTE,COMERCIALIZADORA PORCICOLA MEXICANA SA DE CV,461121,Comercio al por menor de carnes rojas,0 a 5 personas,CALLE,AGUSTIN DE ITURBIDE,CALLE,VICENTE GUERRERO,CALLE,MIGUEL HIDALGO,CALLE,GRAL IGNACIO COMONFORT,400,,,NA,NA,,COLONIA,LAS FLORES,,,,86150,27,TABASCO,4,Centro,1,Villahermosa,244,25,,MPEREZ@KEKEN.COM.MX,WWW.KEKEN.COM.MX,Fijo,17.97244778,-92.95775062,2010-07,46112
9161,8336172,FRUTAS Y VERDURAS SIN NOMBRE,,461130,Comercio al por menor de frutas y verduras frescas,0 a 5 personas,BOULEVARD,ADOLFO RUIZ CORTINES,AVENIDA,CONSTITUCION,AVENIDA,JOSE MARIA PINO SUAREZ,CALLE,AMADO NERVO,NA,SN,"TIANGUIS, BAZAR O PULGA",17,NA,,COLONIA,ARBOLEDAS,"TIANGUIS, BAZAR O PULGA",TIANGUIS CAMPESINO JESUS TARACENA MARTINEZ,83 84,86000,27,TABASCO,4,Centro,1,Villahermosa,723,8,,,,Fijo,17.9976765,-92.91356261,2019-11,46113
9180,7329602,FRUTAS YY VERDURAS,,461130,Comercio al por menor de frutas y verduras frescas,0 a 5 personas,CALLE,LAGUNA DE LAS ILUSIONES,CALLE,LAGUNA DEL ROSARIO,CALLE,LAGUNA COVADONGA,CALLE,LAGUNA DEL ESPEJO,212,,,NA,NA,,COLONIA,LA MANGA III,,,,86068,27,TABASCO,4,Centro,1,Villahermosa,1242,19,,,,Fijo,17.99506947,-92.90852829,2019-11,46113
9266,4017581,FRUTERIA DOÑA ROSA,,461130,Comercio al por menor de frutas y verduras frescas,0 a 5 personas,CALLE,ADOLFO RUIZ CORTINES,AVENIDA,MIGUEL ORRICO DE LOS LLANOS,CALLE,16 DE SEPTIEMBRE,CALLE,27 DE FEBRERO,1,,MERCADO PUBLICO,1,NA,,COLONIA,PUEBLO NUEVO,MERCADO PUBLICO,PROFESOR FAUSTO MENDEZ JIMENEZ,39,86870,27,TABASCO,15,Tacotalpa,1,Tacotalpa,163,6,,,,Fijo,17.59503791,-92.82584628,2010-07,46113
9396,7329346,FRUTERIA JUAREZ,,461130,Comercio al por menor de frutas y verduras frescas,0 a 5 personas,AVENIDA,MARTIRES DE CANANEA,ANDADOR,ANDADOR DEL ELECTRICISTA,AVENIDA,MARTIRES DE RIO BLANCO,ANDADOR,ANDADOR DEL ALFARERO,NA,SN,,NA,NA,,COLONIA,COLONIA INDECO,,,,86017,27,TABASCO,4,Centro,1,Villahermosa,1204,23,,,,Fijo,18.0194311,-92.89982865,2019-11,46113
9645,3980803,FRUTERIA SIN NOMBRE,,461130,Comercio al por menor de frutas y verduras frescas,0 a 5 personas,BOULEVARD,ADOLFO RUIZ CORTINES,AVENIDA,CONSTITUCION,AVENIDA,JOSE MARIA PINO SUAREZ,CALLE,AMADO NERVO,NA,SN,"TIANGUIS, BAZAR O PULGA",17,NA,,COLONIA,ARBOLEDAS,"TIANGUIS, BAZAR O PULGA",TIANGUIS CAMPESINO JESUS TARACENA MARTINEZ,SN,86000,27,TABASCO,4,Centro,1,Villahermosa,723,8,,,,Fijo,17.9976765,-92.91356261,2010-07,46113
9761,7356710,FRUTERIA SIN NOMBRE,,461130,Comercio al por menor de frutas y verduras frescas,0 a 5 personas,AVENIDA,FRANCISCO VILLA,CALLE,CORREDOR DUCTOS PEMEX,CALLE,NINGUNO,CERRADA,ANDADOR ESPERANZA,0,SN,,NA,0,,COLONIA,ROBERTO MADRAZO,,,,86019,27,TABASCO,4,Centro,1,Villahermosa,1666,66,,,,Fijo,18.02437984,-92.89466621,2019-11,46113
9818,3975172,FRUTERÍA Y ABARROTES LA FÉ EN DIOS,,461130,Comercio al por menor de frutas y verduras frescas,0 a 5 personas,CALLE,JOSE MARIA MORELOS Y PAVON,AVENIDA,27 DE FEBRERO,CALLE,BUENA VISTA,CALLE,MARIANO ABASOLO,307,,,NA,NA,,COLONIA,ATASTA,,,,86100,27,TABASCO,4,Centro,1,Villahermosa,916,26,9931355857,,,Fijo,17.98472601,-92.94769911,2010-07,46113
10011,4008739,LA BENDICION DE DIOS,,461122,Comercio al por menor de carne de aves,6 a 10 personas,CALLE,CUATRO,ANDADOR,TRES,CALLE,SEIS,CERRADA,NINGUNO,NA,SN,,NA,NA,,COLONIA,CARLOS A.MADRAZO,,,,86126,27,TABASCO,4,Centro,1,Villahermosa,219A,9,,,,Fijo,17.9741973,-92.98691257,2014-12,46112
11079,9359759,MINI TIENDITA KARLA YARELI,,462112,Comercio al por menor en minisupers,0 a 5 personas,PRIVADA,NINGUNO,CALLE,PRIMERA CERRADA DE AVENIDA UNIVERSIDAD,PROLONGACION,FRANCISCO JAVIER MINA,PROLONGACION,FRANCISCO JAVIER MINA,337,,,NA,NA,,PROLONGACION,FRANCISCO JAVIER MINA,,,,86060,27,TABASCO,4,Centro,1,Villahermosa,105A,27,9932581883,,,Fijo,18.01081324,-92.9202713,2021-05,46211
11227,3975070,MINISUPER MIGUEL ANGEL,,462112,Comercio al por menor en minisupers,6 a 10 personas,CALLE,IGNACIO GUTIERREZ,PRIVADA,NINGUNO,CALLE,NIÑOS HEROES,CERRADA,EMILIO CARRANZA,106,,,NA,NA,,COLONIA,JOSE COLOMO,,,,86100,27,TABASCO,4,Centro,1,Villahermosa,916,11,,,,Fijo,17.98628147,-92.94653439,2010-07,46211
11466,6400863,OXXO SUC 50BHZ BONANZA VSA,CADENA COMERCIAL OXXO SA DE CV,462112,Comercio al por menor en minisupers,6 a 10 personas,AVENIDA,NUEVA IMAGEN,CALLE,SEIS,CALLE,SIETE,BOULEVARD,BONANZA,0,SN,,NA,NA,,COLONIA,BONANZA,,,,86030,27,TABASCO,4,Centro,1,Villahermosa,51,7,,ATENCIONCLIENTES@OXXO.COM,WWW.OXXO.COM,Fijo,18.00472078,-92.93971483,2010-07,46211
